iso_639_3,script,language_code,language_name,character,unicode_category,unicode_name,total_frequency_all_time,time_periods_with_data_count,time_periods_list,year_2017_frequency,year_2022_frequency
avn,Latn,avn_Latn,Avatime, ,Zs,SPACE,2631,2,"2017,2022",604,2027
avn,Latn,avn_Latn,Avatime,a,Ll,LATIN SMALL LETTER A,1141,2,"2017,2022",272,869
avn,Latn,avn_Latn,Avatime,ɛ,Ll,LATIN SMALL LETTER OPEN E,938,2,"2017,2022",147,791
avn,Latn,avn_Latn,Avatime,i,Ll,LATIN SMALL LETTER I,893,2,"2017,2022",209,684
avn,Latn,avn_Latn,Avatime,e,Ll,LATIN SMALL LETTER E,683,2,"2017,2022",183,500
avn,Latn,avn_Latn,Avatime,ɔ,Ll,LATIN SMALL LETTER OPEN O,678,2,"2017,2022",119,559
avn,Latn,avn_Latn,Avatime,n,Ll,LATIN SMALL LETTER N,546,2,"2017,2022",113,433
avn,Latn,avn_Latn,Avatime,l,Ll,LATIN SMALL LETTER L,498,2,"2017,2022",98,400
avn,Latn,avn_Latn,Avatime,k,Ll,LATIN SMALL LETTER K,482,2,"2017,2022",64,418
avn,Latn,avn_Latn,Avatime,b,Ll,LATIN SMALL LETTER B,458,2,"2017,2022",87,371
avn,Latn,avn_Latn,Avatime,s,Ll,LATIN SMALL LETTER S,391,2,"2017,2022",78,313
avn,Latn,avn_Latn,Avatime,u,Ll,LATIN SMALL LETTER U,357,2,"2017,2022",57,300
avn,Latn,avn_Latn,Avatime,m,Ll,LATIN SMALL LETTER M,298,2,"2017,2022",68,230
avn,Latn,avn_Latn,Avatime,y,Ll,LATIN SMALL LETTER Y,273,2,"2017,2022",80,193
avn,Latn,avn_Latn,Avatime,o,Ll,LATIN SMALL LETTER O,269,2,"2017,2022",97,172
avn,Latn,avn_Latn,Avatime,t,Ll,LATIN SMALL LETTER T,247,2,"2017,2022",45,202
avn,Latn,avn_Latn,Avatime,p,Ll,LATIN SMALL LETTER P,207,2,"2017,2022",75,132
avn,Latn,avn_Latn,Avatime,",",Po,COMMA,192,2,"2017,2022",48,144
avn,Latn,avn_Latn,Avatime,d,Ll,LATIN SMALL LETTER D,165,2,"2017,2022",37,128
avn,Latn,avn_Latn,Avatime,g,Ll,LATIN SMALL LETTER G,163,2,"2017,2022",25,138
avn,Latn,avn_Latn,Avatime,z,Ll,LATIN SMALL LETTER Z,145,2,"2017,2022",35,110
avn,Latn,avn_Latn,Avatime,.,Po,FULL STOP,136,2,"2017,2022",38,98
avn,Latn,avn_Latn,Avatime,w,Ll,LATIN SMALL LETTER W,111,2,"2017,2022",17,94
avn,Latn,avn_Latn,Avatime,í,Ll,LATIN SMALL LETTER I WITH ACUTE,96,2,"2017,2022",19,77
avn,Latn,avn_Latn,Avatime,r,Ll,LATIN SMALL LETTER R,85,2,"2017,2022",51,34
avn,Latn,avn_Latn,Avatime,Y,Lu,LATIN CAPITAL LETTER Y,80,2,"2017,2022",36,44
avn,Latn,avn_Latn,Avatime,f,Ll,LATIN SMALL LETTER F,69,2,"2017,2022",20,49
avn,Latn,avn_Latn,Avatime,ʋ,Ll,LATIN SMALL LETTER V WITH HOOK,67,2,"2017,2022",15,52
avn,Latn,avn_Latn,Avatime,h,Ll,LATIN SMALL LETTER H,65,2,"2017,2022",13,52
avn,Latn,avn_Latn,Avatime,A,Lu,LATIN CAPITAL LETTER A,62,2,"2017,2022",28,34
avn,Latn,avn_Latn,Avatime,x,Ll,LATIN SMALL LETTER X,54,2,"2017,2022",15,39
avn,Latn,avn_Latn,Avatime,1,Nd,DIGIT ONE,42,2,"2017,2022",13,29
avn,Latn,avn_Latn,Avatime,ã,Ll,LATIN SMALL LETTER A WITH TILDE,39,2,"2017,2022",1,38
avn,Latn,avn_Latn,Avatime,M,Lu,LATIN CAPITAL LETTER M,38,2,"2017,2022",10,28
avn,Latn,avn_Latn,Avatime,̀,Mn,COMBINING GRAVE ACCENT,34,2,"2017,2022",2,32
avn,Latn,avn_Latn,Avatime,2,Nd,DIGIT TWO,34,2,"2017,2022",9,25
avn,Latn,avn_Latn,Avatime,L,Lu,LATIN CAPITAL LETTER L,29,2,"2017,2022",8,21
avn,Latn,avn_Latn,Avatime,ŋ,Ll,LATIN SMALL LETTER ENG,28,2,"2017,2022",1,27
avn,Latn,avn_Latn,Avatime,“,Pi,LEFT DOUBLE QUOTATION MARK,27,2,"2017,2022",3,24
avn,Latn,avn_Latn,Avatime,K,Lu,LATIN CAPITAL LETTER K,24,2,"2017,2022",4,20
avn,Latn,avn_Latn,Avatime,3,Nd,DIGIT THREE,21,2,"2017,2022",3,18
avn,Latn,avn_Latn,Avatime,Ɔ,Lu,LATIN CAPITAL LETTER OPEN O,20,2,"2017,2022",2,18
avn,Latn,avn_Latn,Avatime,4,Nd,DIGIT FOUR,20,2,"2017,2022",3,17
avn,Latn,avn_Latn,Avatime,B,Lu,LATIN CAPITAL LETTER B,19,2,"2017,2022",9,10
avn,Latn,avn_Latn,Avatime,v,Ll,LATIN SMALL LETTER V,19,2,"2017,2022",1,18
avn,Latn,avn_Latn,Avatime,ɖ,Ll,LATIN SMALL LETTER D WITH TAIL,18,1,2022,0,18
avn,Latn,avn_Latn,Avatime,I,Lu,LATIN CAPITAL LETTER I,18,2,"2017,2022",6,12
avn,Latn,avn_Latn,Avatime,P,Lu,LATIN CAPITAL LETTER P,17,2,"2017,2022",4,13
avn,Latn,avn_Latn,Avatime,D,Lu,LATIN CAPITAL LETTER D,16,2,"2017,2022",14,2
avn,Latn,avn_Latn,Avatime,̃,Mn,COMBINING TILDE,14,1,2022,0,14
avn,Latn,avn_Latn,Avatime,N,Lu,LATIN CAPITAL LETTER N,13,2,"2017,2022",7,6
avn,Latn,avn_Latn,Avatime,5,Nd,DIGIT FIVE,12,2,"2017,2022",3,9
avn,Latn,avn_Latn,Avatime,S,Lu,LATIN CAPITAL LETTER S,12,2,"2017,2022",8,4
avn,Latn,avn_Latn,Avatime,’,Pf,RIGHT SINGLE QUOTATION MARK,11,1,2022,0,11
avn,Latn,avn_Latn,Avatime,‘,Pi,LEFT SINGLE QUOTATION MARK,11,1,2022,0,11
avn,Latn,avn_Latn,Avatime,á,Ll,LATIN SMALL LETTER A WITH ACUTE,11,2,"2017,2022",2,9
avn,Latn,avn_Latn,Avatime,X,Lu,LATIN CAPITAL LETTER X,11,2,"2017,2022",4,7
avn,Latn,avn_Latn,Avatime,ũ,Ll,LATIN SMALL LETTER U WITH TILDE,11,2,"2017,2022",1,10
avn,Latn,avn_Latn,Avatime,O,Lu,LATIN CAPITAL LETTER O,11,2,"2017,2022",4,7
avn,Latn,avn_Latn,Avatime,”,Pf,RIGHT DOUBLE QUOTATION MARK,10,2,"2017,2022",3,7
avn,Latn,avn_Latn,Avatime,6,Nd,DIGIT SIX,10,2,"2017,2022",2,8
avn,Latn,avn_Latn,Avatime,ĩ,Ll,LATIN SMALL LETTER I WITH TILDE,10,1,2022,0,10
avn,Latn,avn_Latn,Avatime,E,Lu,LATIN CAPITAL LETTER E,9,2,"2017,2022",6,3
avn,Latn,avn_Latn,Avatime,8,Nd,DIGIT EIGHT,9,2,"2017,2022",2,7
avn,Latn,avn_Latn,Avatime,ì,Ll,LATIN SMALL LETTER I WITH GRAVE,9,2,"2017,2022",2,7
avn,Latn,avn_Latn,Avatime,7,Nd,DIGIT SEVEN,9,2,"2017,2022",2,7
avn,Latn,avn_Latn,Avatime,9,Nd,DIGIT NINE,8,2,"2017,2022",2,6
avn,Latn,avn_Latn,Avatime,0,Nd,DIGIT ZERO,8,2,"2017,2022",2,6
avn,Latn,avn_Latn,Avatime,́,Mn,COMBINING ACUTE ACCENT,8,2,"2017,2022",3,5
avn,Latn,avn_Latn,Avatime,è,Ll,LATIN SMALL LETTER E WITH GRAVE,7,1,2022,0,7
avn,Latn,avn_Latn,Avatime,à,Ll,LATIN SMALL LETTER A WITH GRAVE,7,1,2022,0,7
avn,Latn,avn_Latn,Avatime,:,Po,COLON,6,2,"2017,2022",5,1
avn,Latn,avn_Latn,Avatime,G,Lu,LATIN CAPITAL LETTER G,6,1,2022,0,6
avn,Latn,avn_Latn,Avatime,ú,Ll,LATIN SMALL LETTER U WITH ACUTE,5,1,2022,0,5
avn,Latn,avn_Latn,Avatime,R,Lu,LATIN CAPITAL LETTER R,4,1,2017,4,0
avn,Latn,avn_Latn,Avatime,Z,Lu,LATIN CAPITAL LETTER Z,4,1,2017,4,0
avn,Latn,avn_Latn,Avatime,?,Po,QUESTION MARK,4,1,2022,0,4
avn,Latn,avn_Latn,Avatime,W,Lu,LATIN CAPITAL LETTER W,3,1,2022,0,3
avn,Latn,avn_Latn,Avatime,),Pe,RIGHT PARENTHESIS,3,1,2022,0,3
avn,Latn,avn_Latn,Avatime,(,Ps,LEFT PARENTHESIS,3,1,2022,0,3
avn,Latn,avn_Latn,Avatime,U,Lu,LATIN CAPITAL LETTER U,3,1,2017,3,0
avn,Latn,avn_Latn,Avatime,T,Lu,LATIN CAPITAL LETTER T,3,2,"2017,2022",1,2
avn,Latn,avn_Latn,Avatime,!,Po,EXCLAMATION MARK,3,1,2022,0,3
avn,Latn,avn_Latn,Avatime,F,Lu,LATIN CAPITAL LETTER F,2,1,2022,0,2
avn,Latn,avn_Latn,Avatime,ó,Ll,LATIN SMALL LETTER O WITH ACUTE,2,2,"2017,2022",1,1
avn,Latn,avn_Latn,Avatime,é,Ll,LATIN SMALL LETTER E WITH ACUTE,2,2,"2017,2022",1,1
avn,Latn,avn_Latn,Avatime,ù,Ll,LATIN SMALL LETTER U WITH GRAVE,1,1,2022,0,1
avn,Latn,avn_Latn,Avatime,C,Lu,LATIN CAPITAL LETTER C,1,1,2017,1,0
